"Time","Source","Destination","Length","Protocol","Info"
"0.000000","185.220.101.164","54.36.163.65","322","TLSv1.2","Ignored Unknown Record"
"0.520943","185.220.101.164","54.36.163.65","636","TLSv1.2","[TCP Previous segment not captured] , Ignored Unknown Record"
"0.597644","185.220.101.164","54.36.163.65","1480","TCP","24824  >  8001 [PSH, ACK] Seq=1863 Ack=1 Win=21 Len=1420 [TCP segment of a reassembled PDU]"
"0.625545","185.220.101.164","54.36.163.65","292","TCP","[TCP Previous segment not captured] 24824  >  8001 [PSH, ACK] Seq=4307 Ack=1 Win=21 Len=232 [TCP segment of a reassembled PDU]"
"0.625545","185.220.101.164","54.36.163.65","1084","TCP","[TCP Out-Of-Order] 24824  >  8001 [ACK] Seq=3283 Ack=1 Win=21 Len=1024 [TCP segment of a reassembled PDU]"
"0.764457","185.220.101.164","54.36.163.65","374","TCP","[TCP Previous segment not captured] 24824  >  8001 [PSH, ACK] Seq=5563 Ack=1 Win=21 Len=314 [TCP segment of a reassembled PDU]"
"0.764457","185.220.101.164","54.36.163.65","1084","TCP","[TCP Out-Of-Order] 24824  >  8001 [ACK] Seq=4539 Ack=1 Win=21 Len=1024 [TCP segment of a reassembled PDU]"
"0.908935","185.220.101.164","54.36.163.65","1554","TLSv1.2","Application Data, Application Data"
"0.955706","185.220.101.164","54.36.163.65","1480","TCP","24824  >  8001 [PSH, ACK] Seq=7371 Ack=1 Win=21 Len=1420 [TCP segment of a reassembled PDU]"
"1.031927","185.220.101.164","54.36.163.65","1480","TLSv1.2","Application Data [TCP segment of a reassembled PDU]"
"1.295991","185.220.101.164","54.36.163.65","162","TLSv1.2","[TCP Previous segment not captured] , Ignored Unknown Record"
"1.326774","185.220.101.164","54.36.163.65","982","TLSv1.2","Ignored Unknown Record"
"1.367030","185.220.101.164","54.36.163.65","1480","TLSv1.2","Ignored Unknown Record"
"1.408769","185.220.101.164","54.36.163.65","1234","TLSv1.2","Ignored Unknown Record"
"1.672180","185.220.101.164","54.36.163.65","2108","TLSv1.2","Ignored Unknown Record"
"1.672181","185.220.101.164","54.36.163.65","852","TLSv1.2","Ignored Unknown Record"
"1.848620","185.220.101.164","54.36.163.65","233","TLSv1.2","[TCP Previous segment not captured] , Ignored Unknown Record"
"2.076118","185.220.101.164","54.36.163.65","603","TLSv1.2","Application Data"
"2.269036","185.220.101.164","54.36.163.65","1117","TLSv1.2","Application Data"
"2.509565","185.220.101.164","54.36.163.65","374","TLSv1.2","[TCP Previous segment not captured] , Ignored Unknown Record"
"2.539388","185.220.101.164","54.36.163.65","456","TLSv1.2","[TCP Previous segment not captured] , Ignored Unknown Record"
"2.558875","185.220.101.164","54.36.163.65","1084","TLSv1.2","Ignored Unknown Record"
"2.559858","185.220.101.164","54.36.163.65","496","TLSv1.2","Ignored Unknown Record"
"2.581352","185.220.101.164","54.36.163.65","1440","TLSv1.2","Ignored Unknown Record"
"2.650526","185.220.101.164","54.36.163.65","195","TLSv1.2","[TCP Previous segment not captured] , Ignored Unknown Record"
"2.673433","185.220.101.164","54.36.163.65","1480","TLSv1.2","Ignored Unknown Record"
"2.777756","185.220.101.164","54.36.163.65","456","TLSv1.2","[TCP Previous segment not captured] , Ignored Unknown Record"
"2.943535","185.220.101.164","54.36.163.65","1084","TLSv1.2","Ignored Unknown Record"
"2.943535","185.220.101.164","54.36.163.65","400","TLSv1.2","[TCP Previous segment not captured] , Ignored Unknown Record"
"2.968332","185.220.101.164","54.36.163.65","908","TLSv1.2","Ignored Unknown Record"
"3.054115","185.220.101.164","54.36.163.65","1480","TLSv1.2","Ignored Unknown Record"
"3.091533","185.220.101.164","54.36.163.65","906","TLSv1.2","Ignored Unknown Record"
"3.283905","185.220.101.164","54.36.163.65","374","TLSv1.2","[TCP Previous segment not captured] , Ignored Unknown Record"
"3.346789","185.220.101.164","54.36.163.65","1398","TLSv1.2","Ignored Unknown Record"
"3.410483","185.220.101.164","54.36.163.65","511","TLSv1.2","Ignored Unknown Record"
"3.566331","185.220.101.164","54.36.163.65","1398","TLSv1.2","Application Data, Application Data"
"3.619366","185.220.101.164","54.36.163.65","351","TLSv1.2","Application Data"
"3.986968","185.220.101.164","54.36.163.65","603","TLSv1.2","Application Data"
"4.019150","185.220.101.164","54.36.163.65","1480","TCP","24824  >  8001 [PSH, ACK] Seq=45134 Ack=1 Win=21 Len=1420 [TCP segment of a reassembled PDU]"
"4.051492","185.220.101.164","54.36.163.65","456","TCP","[TCP Previous segment not captured] 24824  >  8001 [PSH, ACK] Seq=47578 Ack=1 Win=21 Len=396 [TCP segment of a reassembled PDU]"
"4.051493","185.220.101.164","54.36.163.65","1084","TCP","[TCP Out-Of-Order] 24824  >  8001 [ACK] Seq=46554 Ack=1 Win=21 Len=1024 [TCP segment of a reassembled PDU]"
"4.213330","185.220.101.164","54.36.163.65","2108","TLSv1.2","Application Data [TCP segment of a reassembled PDU]"
"4.213331","185.220.101.164","54.36.163.65","1104","TCP","24824  >  8001 [PSH, ACK] Seq=50022 Ack=1 Win=21 Len=1044 [TCP segment of a reassembled PDU]"
"4.272886","185.220.101.164","54.36.163.65","818","TCP","24824  >  8001 [PSH, ACK] Seq=51066 Ack=1 Win=21 Len=758 [TCP segment of a reassembled PDU]"
"4.295506","185.220.101.164","54.36.163.65","1398","TCP","24824  >  8001 [PSH, ACK] Seq=51824 Ack=1 Win=21 Len=1338 [TCP segment of a reassembled PDU]"
"4.316533","185.220.101.164","54.36.163.65","1480","TLSv1.2","Application Data [TCP segment of a reassembled PDU]"
"4.390244","185.220.101.164","54.36.163.65","1316","TCP","24824  >  8001 [PSH, ACK] Seq=54582 Ack=1 Win=21 Len=1256 [TCP segment of a reassembled PDU]"
"4.572310","185.220.101.164","54.36.163.65","1398","TLSv1.2","Application Data, Application Data"
"4.770953","185.220.101.164","54.36.163.65","524","TLSv1.2","[TCP Previous segment not captured] , Ignored Unknown Record"
"4.816209","185.220.101.164","54.36.163.65","316","TLSv1.2","Ignored Unknown Record"
"5.266870","185.220.101.164","54.36.163.65","869","TLSv1.2","[TCP Previous segment not captured] , Ignored Unknown Record"
"5.413228","185.220.101.164","54.36.163.65","603","TLSv1.2","Application Data"
"5.472796","185.220.101.164","54.36.163.65","374","TLSv1.2","[TCP Previous segment not captured] , Ignored Unknown Record"
"5.533452","185.220.101.164","54.36.163.65","322","TLSv1.2","Ignored Unknown Record"
"6.018906","185.220.101.164","54.36.163.65","1084","TLSv1.2","[TCP Previous segment not captured] , Ignored Unknown Record"
"6.018906","185.220.101.164","54.36.163.65","400","TLSv1.2","[TCP Previous segment not captured] , Ignored Unknown Record"
"6.041792","185.220.101.164","54.36.163.65","530","TLSv1.2","[TCP Previous segment not captured] , Ignored Unknown Record"
"6.064158","185.220.101.164","54.36.163.65","1844","TLSv1.2","Ignored Unknown Record"
"6.227497","185.220.101.164","54.36.163.65","852","TLSv1.2","[TCP Previous segment not captured] , Ignored Unknown Record"
"6.280801","185.220.101.164","54.36.163.65","1480","TLSv1.2","Ignored Unknown Record"
"6.343806","185.220.101.164","54.36.163.65","1480","TLSv1.2","Ignored Unknown Record"
"6.397857","185.220.101.164","54.36.163.65","1480","TLSv1.2","Ignored Unknown Record"
"6.443711","185.220.101.164","54.36.163.65","1480","TLSv1.2","Ignored Unknown Record"
"6.551916","185.220.101.164","54.36.163.65","456","TLSv1.2","[TCP Previous segment not captured] , Ignored Unknown Record"
"6.589816","185.220.101.164","54.36.163.65","1157","TLSv1.2","Ignored Unknown Record"
"6.770747","185.220.101.164","54.36.163.65","1398","TLSv1.2","Ignored Unknown Record"
"6.835684","185.220.101.164","54.36.163.65","374","TLSv1.2","[TCP Previous segment not captured] , Ignored Unknown Record"
"6.865135","185.220.101.164","54.36.163.65","478","TLSv1.2","Ignored Unknown Record"
"7.323589","185.220.101.164","54.36.163.65","1084","TLSv1.2","[TCP Previous segment not captured] , Ignored Unknown Record"
"7.323589","185.220.101.164","54.36.163.65","518","TLSv1.2","Ignored Unknown Record"
"7.365879","185.220.101.164","54.36.163.65","456","TLSv1.2","[TCP Previous segment not captured] , Ignored Unknown Record"
"7.441892","185.220.101.164","54.36.163.65","210","TLSv1.2","[TCP Previous segment not captured] , Ignored Unknown Record"
"7.469542","185.220.101.164","54.36.163.65","1398","TLSv1.2","Ignored Unknown Record"
"7.557203","185.220.101.164","54.36.163.65","456","TLSv1.2","[TCP Previous segment not captured] , Ignored Unknown Record"
"7.586153","185.220.101.164","54.36.163.65","1480","TLSv1.2","Ignored Unknown Record"
"7.687120","185.220.101.164","54.36.163.65","1480","TLSv1.2","Ignored Unknown Record"
"7.718965","185.220.101.164","54.36.163.65","1480","TLSv1.2","Ignored Unknown Record"
"7.815806","185.220.101.164","54.36.163.65","456","TLSv1.2","[TCP Previous segment not captured] , Ignored Unknown Record"
"7.850193","185.220.101.164","54.36.163.65","988","TLSv1.2","Ignored Unknown Record"
"7.950715","185.220.101.164","54.36.163.65","160","TLSv1.2","Ignored Unknown Record"
"7.978106","185.220.101.164","54.36.163.65","456","TLSv1.2","[TCP Previous segment not captured] , Ignored Unknown Record"
"8.078066","185.220.101.164","54.36.163.65","1316","TLSv1.2","Ignored Unknown Record"
"8.301832","185.220.101.164","54.36.163.65","1084","TLSv1.2","Ignored Unknown Record"
"8.301949","185.220.101.164","54.36.163.65","1084","TLSv1.2","Ignored Unknown Record"
"8.301949","185.220.101.164","54.36.163.65","688","TLSv1.2","Ignored Unknown Record"
"8.419425","185.220.101.164","54.36.163.65","1506","TLSv1.2","Ignored Unknown Record"
"8.793780","185.220.101.164","54.36.163.65","1631","TLSv1.2","Application Data"
"8.836079","185.220.101.164","54.36.163.65","603","TLSv1.2","Application Data"
"9.320122","185.220.101.164","54.36.163.65","2108","TLSv1.2","Application Data, Application Data, Application Data"
"9.320122","185.220.101.164","54.36.163.65","66","TCP","[TCP Previous segment not captured] 24824  >  8001 [PSH, ACK] Seq=115469 Ack=1 Win=21 Len=6 [TCP segment of a reassembled PDU]"
"9.320123","185.220.101.164","54.36.163.65","1084","TCP","[TCP Out-Of-Order] 24824  >  8001 [ACK] Seq=114445 Ack=1 Win=21 Len=1024 [TCP segment of a reassembled PDU]"
"9.349944","185.220.101.164","54.36.163.65","744","TCP","24824  >  8001 [PSH, ACK] Seq=115475 Ack=1 Win=21 Len=684 [TCP segment of a reassembled PDU]"
"9.380721","185.220.101.164","54.36.163.65","1398","TLSv1.2","Application Data [TCP segment of a reassembled PDU]"
"9.411532","185.220.101.164","54.36.163.65","759","TLSv1.2","Application Data"
"9.663900","185.220.101.164","54.36.163.65","456","TLSv1.2","[TCP Previous segment not captured] , Ignored Unknown Record"
"9.735359","185.220.101.164","54.36.163.65","456","TLSv1.2","[TCP Previous segment not captured] , Ignored Unknown Record"
"9.735360","185.220.101.164","54.36.163.65","1084","TCP","[TCP Out-Of-Order] 24824  >  8001 [ACK] Seq=122456 Ack=1 Win=21 Len=1024"
"9.763371","185.220.101.164","54.36.163.65","1480","TLSv1.2","Ignored Unknown Record"
"9.907104","185.220.101.164","54.36.163.65","2108","TLSv1.2","Ignored Unknown Record"
"9.907104","185.220.101.164","54.36.163.65","278","TLSv1.2","Ignored Unknown Record"
"10.366225","185.220.101.164","54.36.163.65","2108","TLSv1.2","Ignored Unknown Record"
"10.516245","185.220.101.164","54.36.163.65","607","TLSv1.2","[TCP Previous segment not captured] , Ignored Unknown Record"
"10.797369","185.220.101.164","54.36.163.65","603","TLSv1.2","Application Data"
"10.846173","185.220.101.164","54.36.163.65","1398","TCP","24824  >  8001 [PSH, ACK] Seq=134304 Ack=1 Win=21 Len=1338 [TCP segment of a reassembled PDU]"
"10.913150","185.220.101.164","54.36.163.65","2108","TCP","24824  >  8001 [PSH, ACK] Seq=135642 Ack=1 Win=21 Len=2048 [TCP segment of a reassembled PDU]"
"10.913150","185.220.101.164","54.36.163.65","852","TLSv1.2","Application Data [TCP segment of a reassembled PDU]"
"11.050178","185.220.101.164","54.36.163.65","2108","TCP","24824  >  8001 [PSH, ACK] Seq=138482 Ack=1 Win=21 Len=2048 [TCP segment of a reassembled PDU]"
"11.050178","185.220.101.164","54.36.163.65","606","TCP","24824  >  8001 [PSH, ACK] Seq=140530 Ack=1 Win=21 Len=546 [TCP segment of a reassembled PDU]"
"11.211702","185.220.101.164","54.36.163.65","2108","TLSv1.2","Application Data [TCP segment of a reassembled PDU]"
"11.211703","185.220.101.164","54.36.163.65","606","TCP","24824  >  8001 [PSH, ACK] Seq=143124 Ack=1 Win=21 Len=546 [TCP segment of a reassembled PDU]"
"11.469210","185.220.101.164","54.36.163.65","2108","TCP","24824  >  8001 [PSH, ACK] Seq=143670 Ack=1 Win=21 Len=2048 [TCP segment of a reassembled PDU]"
"11.469211","185.220.101.164","54.36.163.65","852","TCP","24824  >  8001 [PSH, ACK] Seq=145718 Ack=1 Win=21 Len=792 [TCP segment of a reassembled PDU]"
"11.515067","185.220.101.164","54.36.163.65","1234","TLSv1.2","Application Data [TCP segment of a reassembled PDU]"
"11.615456","185.220.101.164","54.36.163.65","1398","TCP","[TCP Previous segment not captured] 24824  >  8001 [PSH, ACK] Seq=148812 Ack=1 Win=21 Len=1338 [TCP segment of a reassembled PDU]"
"11.661067","185.220.101.164","54.36.163.65","456","TCP","[TCP Previous segment not captured] 24824  >  8001 [PSH, ACK] Seq=151174 Ack=1 Win=21 Len=396 [TCP segment of a reassembled PDU]"
"11.661067","185.220.101.164","54.36.163.65","1084","TCP","[TCP Out-Of-Order] 24824  >  8001 [ACK] Seq=150150 Ack=1 Win=21 Len=1024 [TCP segment of a reassembled PDU]"
"11.745496","185.220.101.164","54.36.163.65","292","TCP","[TCP Previous segment not captured] 24824  >  8001 [PSH, ACK] Seq=152594 Ack=1 Win=21 Len=232 [TCP segment of a reassembled PDU]"
"11.745497","185.220.101.164","54.36.163.65","1084","TCP","[TCP Out-Of-Order] 24824  >  8001 [ACK] Seq=151570 Ack=1 Win=21 Len=1024 [TCP segment of a reassembled PDU]"
"12.609850","185.220.101.164","54.36.163.65","2108","TLSv1.2","Application Data, Application Data, Application Data, Application Data, Application Data"
"12.609851","185.220.101.164","54.36.163.65","883","TLSv1.2","Application Data, Application Data"
"12.782265","185.220.101.164","54.36.163.65","456","TLSv1.2","[TCP Previous segment not captured] , Ignored Unknown Record"
"12.899002","185.220.101.164","54.36.163.65","1316","TLSv1.2","Ignored Unknown Record"
"13.095857","185.220.101.164","54.36.163.65","2108","TLSv1.2","Ignored Unknown Record"
"13.095857","185.220.101.164","54.36.163.65","688","TLSv1.2","Ignored Unknown Record"
"13.124119","185.220.101.164","54.36.163.65","1398","TLSv1.2","Ignored Unknown Record"
"13.413507","185.220.101.164","54.36.163.65","1398","TLSv1.2","Ignored Unknown Record"
"13.635458","185.220.101.164","54.36.163.65","2108","TCP","24824  >  8001 [PSH, ACK] Seq=166401 Ack=1 Win=21 Len=2048 [TCP segment of a reassembled PDU]"
"13.635458","185.220.101.164","54.36.163.65","688","TCP","24824  >  8001 [PSH, ACK] Seq=168449 Ack=1 Win=21 Len=628 [TCP segment of a reassembled PDU]"
"14.301481","185.220.101.164","54.36.163.65","2108","TCP","24824  >  8001 [PSH, ACK] Seq=169077 Ack=1 Win=21 Len=2048 [TCP segment of a reassembled PDU]"
"14.301482","185.220.101.164","54.36.163.65","1342","TCP","24824  >  8001 [PSH, ACK] Seq=171125 Ack=1 Win=21 Len=1282 [TCP segment of a reassembled PDU]"
"14.314428","185.220.101.164","54.36.163.65","2108","TCP","24824  >  8001 [PSH, ACK] Seq=172407 Ack=1 Win=21 Len=2048 [TCP segment of a reassembled PDU]"
"14.314428","185.220.101.164","54.36.163.65","1084","TCP","24824  >  8001 [ACK] Seq=174455 Ack=1 Win=21 Len=1024 [TCP segment of a reassembled PDU]"
"14.322114","185.220.101.164","54.36.163.65","474","TCP","24824  >  8001 [PSH, ACK] Seq=175479 Ack=1 Win=21 Len=414 [TCP segment of a reassembled PDU]"
"14.323819","185.220.101.164","54.36.163.65","1084","TCP","24824  >  8001 [ACK] Seq=175893 Ack=1 Win=21 Len=1024 [TCP segment of a reassembled PDU]"
"14.342402","185.220.101.164","54.36.163.65","658","TCP","24824  >  8001 [PSH, ACK] Seq=176917 Ack=1 Win=21 Len=598 [TCP segment of a reassembled PDU]"
"14.346408","185.220.101.164","54.36.163.65","1084","TCP","24824  >  8001 [ACK] Seq=177515 Ack=1 Win=21 Len=1024 [TCP segment of a reassembled PDU]"
"14.362773","185.220.101.164","54.36.163.65","456","TCP","24824  >  8001 [PSH, ACK] Seq=178539 Ack=1 Win=21 Len=396 [TCP segment of a reassembled PDU]"
"14.440226","185.220.101.164","54.36.163.65","852","TCP","24824  >  8001 [PSH, ACK] Seq=178935 Ack=1 Win=21 Len=792 [TCP segment of a reassembled PDU]"
"14.525134","185.220.101.164","54.36.163.65","2108","TCP","24824  >  8001 [PSH, ACK] Seq=179727 Ack=1 Win=21 Len=2048 [TCP segment of a reassembled PDU]"
"14.525134","185.220.101.164","54.36.163.65","688","TCP","24824  >  8001 [PSH, ACK] Seq=181775 Ack=1 Win=21 Len=628 [TCP segment of a reassembled PDU]"
"14.803515","185.220.101.164","54.36.163.65","1480","TCP","24824  >  8001 [PSH, ACK] Seq=182403 Ack=1 Win=21 Len=1420 [TCP segment of a reassembled PDU]"
"14.891996","185.220.101.164","54.36.163.65","456","TCP","[TCP Previous segment not captured] 24824  >  8001 [PSH, ACK] Seq=187441 Ack=1 Win=21 Len=396 [TCP segment of a reassembled PDU]"
"14.935509","185.220.101.164","54.36.163.65","456","TCP","[TCP Previous segment not captured] 24824  >  8001 [PSH, ACK] Seq=188861 Ack=1 Win=21 Len=396 [TCP segment of a reassembled PDU]"
"14.935509","185.220.101.164","54.36.163.65","1084","TCP","[TCP Out-Of-Order] 24824  >  8001 [ACK] Seq=187837 Ack=1 Win=21 Len=1024 [TCP segment of a reassembled PDU]"
"15.002116","185.220.101.164","54.36.163.65","210","TCP","[TCP Previous segment not captured] 24824  >  8001 [PSH, ACK] Seq=190281 Ack=1 Win=21 Len=150 [TCP segment of a reassembled PDU]"
"15.002116","185.220.101.164","54.36.163.65","1084","TCP","[TCP Out-Of-Order] 24824  >  8001 [ACK] Seq=189257 Ack=1 Win=21 Len=1024 [TCP segment of a reassembled PDU]"
"15.036181","185.220.101.164","54.36.163.65","1480","TCP","24824  >  8001 [PSH, ACK] Seq=190431 Ack=1 Win=21 Len=1420 [TCP segment of a reassembled PDU]"
"15.130385","185.220.101.164","54.36.163.65","292","TLSv1.2","[TCP Previous segment not captured] , Ignored Unknown Record"
"15.130386","185.220.101.164","54.36.163.65","1084","TCP","[TCP Out-Of-Order] 24824  >  8001 [ACK] Seq=191851 Ack=1 Win=21 Len=1024 [TCP segment of a reassembled PDU]"
"15.172960","185.220.101.164","54.36.163.65","1480","TLSv1.2","Ignored Unknown Record"
"15.368758","185.220.101.164","54.36.163.65","2108","TLSv1.2","Ignored Unknown Record"
"15.401847","185.220.101.164","54.36.163.65","456","TLSv1.2","[TCP Previous segment not captured] , Ignored Unknown Record"
"15.439353","185.220.101.164","54.36.163.65","318","TLSv1.2","Ignored Unknown Record"
"16.000133","185.220.101.164","54.36.163.65","2108","TLSv1.2","Application Data, Application Data"
"16.080221","185.220.101.164","54.36.163.65","128","TLSv1.2","[TCP Previous segment not captured] , Ignored Unknown Record"
"16.108013","185.220.101.164","54.36.163.65","374","TLSv1.2","[TCP Previous segment not captured] , Ignored Unknown Record"
"16.375948","185.220.101.164","54.36.163.65","1814","TLSv1.2","Ignored Unknown Record"
"16.466941","185.220.101.164","54.36.163.65","2108","TLSv1.2","Ignored Unknown Record"
"16.466941","185.220.101.164","54.36.163.65","606","TLSv1.2","Ignored Unknown Record"
"16.536098","185.220.101.164","54.36.163.65","1480","TLSv1.2","Ignored Unknown Record"
"16.568129","185.220.101.164","54.36.163.65","292","TLSv1.2","[TCP Previous segment not captured] , Ignored Unknown Record"
"16.676650","185.220.101.164","54.36.163.65","1398","TLSv1.2","Ignored Unknown Record"
"16.703921","185.220.101.164","54.36.163.65","374","TLSv1.2","[TCP Previous segment not captured] , Ignored Unknown Record"
"16.786172","185.220.101.164","54.36.163.65","1480","TLSv1.2","Ignored Unknown Record"
"16.822564","185.220.101.164","54.36.163.65","1316","TLSv1.2","Ignored Unknown Record"
"17.095474","185.220.101.164","54.36.163.65","1398","TLSv1.2","Ignored Unknown Record"
"17.125185","185.220.101.164","54.36.163.65","477","TLSv1.2","Ignored Unknown Record"
"17.371659","185.220.101.164","54.36.163.65","603","TLSv1.2","Application Data"
"17.469975","185.220.101.164","54.36.163.65","603","TLSv1.2","Application Data"
"17.730227","185.220.101.164","54.36.163.65","603","TLSv1.2","Application Data"
"17.825762","185.220.101.164","54.36.163.65","603","TLSv1.2","Application Data"
"17.951370","185.220.101.164","54.36.163.65","2108","TCP","24824  >  8001 [PSH, ACK] Seq=222931 Ack=1 Win=21 Len=2048 [TCP segment of a reassembled PDU]"
"17.951371","185.220.101.164","54.36.163.65","852","TCP","24824  >  8001 [PSH, ACK] Seq=224979 Ack=1 Win=21 Len=792 [TCP segment of a reassembled PDU]"
"18.071534","185.220.101.164","54.36.163.65","2108","TLSv1.2","Application Data [TCP segment of a reassembled PDU]"
"18.071534","185.220.101.164","54.36.163.65","852","TCP","24824  >  8001 [PSH, ACK] Seq=227819 Ack=1 Win=21 Len=792 [TCP segment of a reassembled PDU]"
"18.261728","185.220.101.164","54.36.163.65","2108","TCP","24824  >  8001 [PSH, ACK] Seq=228611 Ack=1 Win=21 Len=2048 [TCP segment of a reassembled PDU]"
"18.261729","185.220.101.164","54.36.163.65","360","TCP","24824  >  8001 [PSH, ACK] Seq=230659 Ack=1 Win=21 Len=300 [TCP segment of a reassembled PDU]"
"18.559949","185.220.101.164","54.36.163.65","1371","TLSv1.2","Application Data, Application Data"
"18.585907","185.220.101.164","54.36.163.65","1084","TCP","24824  >  8001 [ACK] Seq=232270 Ack=1 Win=21 Len=1024 [TCP segment of a reassembled PDU]"
"18.585908","185.220.101.164","54.36.163.65","1084","TCP","[TCP Previous segment not captured] 24824  >  8001 [ACK] Seq=234318 Ack=1 Win=21 Len=1024 [TCP segment of a reassembled PDU]"
"18.585908","185.220.101.164","54.36.163.65","1084","TCP","[TCP Out-Of-Order] 24824  >  8001 [PSH, ACK] Seq=233294 Ack=1 Win=21 Len=1024 [TCP segment of a reassembled PDU]"
"18.585908","185.220.101.164","54.36.163.65","326","TCP","24824  >  8001 [PSH, ACK] Seq=235342 Ack=1 Win=21 Len=266 [TCP segment of a reassembled PDU]"
"18.608461","185.220.101.164","54.36.163.65","736","TCP","24824  >  8001 [PSH, ACK] Seq=235608 Ack=1 Win=21 Len=676 [TCP segment of a reassembled PDU]"
"18.635516","185.220.101.164","54.36.163.65","1480","TLSv1.2","Application Data [TCP segment of a reassembled PDU]"
"18.709187","185.220.101.164","54.36.163.65","456","TCP","[TCP Previous segment not captured] 24824  >  8001 [PSH, ACK] Seq=238728 Ack=1 Win=21 Len=396 [TCP segment of a reassembled PDU]"
"18.709187","185.220.101.164","54.36.163.65","1084","TCP","[TCP Out-Of-Order] 24824  >  8001 [ACK] Seq=237704 Ack=1 Win=21 Len=1024 [TCP segment of a reassembled PDU]"
"18.736653","185.220.101.164","54.36.163.65","210","TCP","[TCP Previous segment not captured] 24824  >  8001 [PSH, ACK] Seq=240148 Ack=1 Win=21 Len=150 [TCP segment of a reassembled PDU]"
"18.736654","185.220.101.164","54.36.163.65","1084","TCP","[TCP Out-Of-Order] 24824  >  8001 [ACK] Seq=239124 Ack=1 Win=21 Len=1024 [TCP segment of a reassembled PDU]"
"18.863478","185.220.101.164","54.36.163.65","2108","TLSv1.2","Application Data [TCP segment of a reassembled PDU]"
"18.863478","185.220.101.164","54.36.163.65","688","TCP","24824  >  8001 [PSH, ACK] Seq=242346 Ack=1 Win=21 Len=628 [TCP segment of a reassembled PDU]"
"19.164966","185.220.101.164","54.36.163.65","237","TLSv1.2","Application Data"
"19.343078","185.220.101.164","54.36.163.65","603","TLSv1.2","Application Data"
"19.555029","185.220.101.164","54.36.163.65","603","TLSv1.2","Application Data"
"19.584112","185.220.101.164","54.36.163.65","374","TLSv1.2","[TCP Previous segment not captured] , Ignored Unknown Record"
"19.677768","185.220.101.164","54.36.163.65","807","TLSv1.2","Ignored Unknown Record"
"19.707354","185.220.101.164","54.36.163.65","1398","TCP","24824  >  8001 [PSH, ACK] Seq=246322 Ack=1 Win=21 Len=1338 [TCP segment of a reassembled PDU]"
"19.773227","185.220.101.164","54.36.163.65","1398","TCP","24824  >  8001 [PSH, ACK] Seq=247660 Ack=1 Win=21 Len=1338 [TCP segment of a reassembled PDU]"
"19.800942","185.220.101.164","54.36.163.65","1398","TLSv1.2","Application Data [TCP segment of a reassembled PDU]"
"20.027537","185.220.101.164","54.36.163.65","1480","TLSv1.2","Application Data [TCP segment of a reassembled PDU]"
"20.057807","185.220.101.164","54.36.163.65","2108","TCP","24824  >  8001 [PSH, ACK] Seq=251756 Ack=1 Win=21 Len=2048 [TCP segment of a reassembled PDU]"
"20.057807","185.220.101.164","54.36.163.65","606","TCP","24824  >  8001 [PSH, ACK] Seq=253804 Ack=1 Win=21 Len=546 [TCP segment of a reassembled PDU]"
"20.163212","185.220.101.164","54.36.163.65","2108","TLSv1.2","Application Data [TCP segment of a reassembled PDU]"
"20.163212","185.220.101.164","54.36.163.65","852","TCP","24824  >  8001 [PSH, ACK] Seq=256398 Ack=1 Win=21 Len=792 [TCP segment of a reassembled PDU]"
"20.395610","185.220.101.164","54.36.163.65","2108","TLSv1.2","Application Data [TCP segment of a reassembled PDU]"
"20.395611","185.220.101.164","54.36.163.65","606","TCP","24824  >  8001 [PSH, ACK] Seq=259238 Ack=1 Win=21 Len=546 [TCP segment of a reassembled PDU]"
"20.448476","185.220.101.164","54.36.163.65","1084","TCP","24824  >  8001 [ACK] Seq=259784 Ack=1 Win=21 Len=1024 [TCP segment of a reassembled PDU]"
"20.448476","185.220.101.164","54.36.163.65","606","TCP","[TCP Previous segment not captured] 24824  >  8001 [PSH, ACK] Seq=261832 Ack=1 Win=21 Len=546 [TCP segment of a reassembled PDU]"
"20.448476","185.220.101.164","54.36.163.65","1084","TCP","[TCP Out-Of-Order] 24824  >  8001 [PSH, ACK] Seq=260808 Ack=1 Win=21 Len=1024 [TCP segment of a reassembled PDU]"
"20.545590","185.220.101.164","54.36.163.65","1398","TLSv1.2","Application Data [TCP segment of a reassembled PDU]"
"20.894761","185.220.101.164","54.36.163.65","603","TLSv1.2","[TCP Previous segment not captured] , Application Data"
"20.964972","185.220.101.164","54.36.163.65","1117","TLSv1.2","Application Data"
"21.336973","185.220.101.164","54.36.163.65","2108","TLSv1.2","Application Data, Application Data"
"21.446514","185.220.101.164","54.36.163.65","606","TLSv1.2","[TCP Previous segment not captured] , Ignored Unknown Record"
"21.525130","185.220.101.164","54.36.163.65","456","TLSv1.2","[TCP Previous segment not captured] , Ignored Unknown Record"
"21.559932","185.220.101.164","54.36.163.65","1234","TLSv1.2","Ignored Unknown Record"
"21.677179","185.220.101.164","54.36.163.65","456","TLSv1.2","[TCP Previous segment not captured] , Ignored Unknown Record"
"21.704925","185.220.101.164","54.36.163.65","1480","TLSv1.2","Ignored Unknown Record"
"21.779327","185.220.101.164","54.36.163.65","210","TLSv1.2","[TCP Previous segment not captured] , Ignored Unknown Record"
"21.843768","185.220.101.164","54.36.163.65","374","TLSv1.2","[TCP Previous segment not captured] , Ignored Unknown Record"
"21.903628","185.220.101.164","54.36.163.65","1398","TLSv1.2","Ignored Unknown Record"
"21.997809","185.220.101.164","54.36.163.65","907","TLSv1.2","Ignored Unknown Record"
"22.166267","185.220.101.164","54.36.163.65","456","TLSv1.2","[TCP Previous segment not captured] , Ignored Unknown Record"
"22.392545","185.220.101.164","54.36.163.65","216","TLSv1.2","[TCP Previous segment not captured] , Ignored Unknown Record"
"22.606737","185.220.101.164","54.36.163.65","1660","TLSv1.2","Application Data, Application Data"
"22.976909","185.220.101.164","54.36.163.65","1117","TLSv1.2","Application Data"
"23.006954","185.220.101.164","54.36.163.65","603","TLSv1.2","Application Data"
"23.360711","185.220.101.164","54.36.163.65","374","TLSv1.2","[TCP Previous segment not captured] , Ignored Unknown Record"
"23.442212","185.220.101.164","54.36.163.65","2108","TLSv1.2","Ignored Unknown Record"
"23.442213","185.220.101.164","54.36.163.65","179","TLSv1.2","Ignored Unknown Record"
"23.494727","185.220.101.164","54.36.163.65","292","TLSv1.2","[TCP Previous segment not captured] , Ignored Unknown Record"
"23.524062","185.220.101.164","54.36.163.65","1398","TLSv1.2","Ignored Unknown Record"
"23.554164","185.220.101.164","54.36.163.65","374","TLSv1.2","[TCP Previous segment not captured] , Ignored Unknown Record"
"23.582514","185.220.101.164","54.36.163.65","1398","TLSv1.2","Ignored Unknown Record"
"23.667132","185.220.101.164","54.36.163.65","374","TLSv1.2","[TCP Previous segment not captured] , Ignored Unknown Record"
"23.724185","185.220.101.164","54.36.163.65","456","TLSv1.2","[TCP Previous segment not captured] , Ignored Unknown Record"
"23.786672","185.220.101.164","54.36.163.65","1480","TLSv1.2","Ignored Unknown Record"
"23.825326","185.220.101.164","54.36.163.65","1234","TLSv1.2","Ignored Unknown Record"
"23.918817","185.220.101.164","54.36.163.65","1398","TLSv1.2","Ignored Unknown Record"
"23.949024","185.220.101.164","54.36.163.65","1398","TLSv1.2","Ignored Unknown Record"
"24.035817","185.220.101.164","54.36.163.65","456","TLSv1.2","[TCP Previous segment not captured] , Ignored Unknown Record"
"24.069050","185.220.101.164","54.36.163.65","1316","TLSv1.2","Ignored Unknown Record"
"24.354447","185.220.101.164","54.36.163.65","834","TLSv1.2","[TCP Previous segment not captured] , Ignored Unknown Record"
"24.714055","185.220.101.164","54.36.163.65","603","TLSv1.2","Application Data"
"24.821059","185.220.101.164","54.36.163.65","456","TLSv1.2","[TCP Previous segment not captured] , Ignored Unknown Record"
"24.852985","185.220.101.164","54.36.163.65","456","TLSv1.2","[TCP Previous segment not captured] , Ignored Unknown Record"
"24.852985","185.220.101.164","54.36.163.65","1084","TCP","[TCP Out-Of-Order] 24824  >  8001 [ACK] Seq=316701 Ack=1 Win=21 Len=1024"
"24.956559","185.220.101.164","54.36.163.65","2108","TLSv1.2","Ignored Unknown Record"
"24.956559","185.220.101.164","54.36.163.65","360","TLSv1.2","Ignored Unknown Record"
"25.079773","185.220.101.164","54.36.163.65","1480","TLSv1.2","Ignored Unknown Record"
"25.106397","185.220.101.164","54.36.163.65","1480","TLSv1.2","Ignored Unknown Record"
"25.297457","185.220.101.164","54.36.163.65","1234","TLSv1.2","Ignored Unknown Record"
"25.358077","185.220.101.164","54.36.163.65","984","TLSv1.2","Ignored Unknown Record"
"25.543957","185.220.101.164","54.36.163.65","524","TLSv1.2","[TCP Previous segment not captured] , Ignored Unknown Record"
"25.847249","185.220.101.164","54.36.163.65","456","TLSv1.2","[TCP Previous segment not captured] , Ignored Unknown Record"
"25.880061","185.220.101.164","54.36.163.65","1480","TLSv1.2","Ignored Unknown Record"
"25.910241","185.220.101.164","54.36.163.65","210","TLSv1.2","[TCP Previous segment not captured] , Ignored Unknown Record"
"25.987965","185.220.101.164","54.36.163.65","751","TLSv1.2","Ignored Unknown Record"
"26.178639","185.220.101.164","54.36.163.65","1398","TCP","24824  >  8001 [PSH, ACK] Seq=336802 Ack=1 Win=21 Len=1338 [TCP segment of a reassembled PDU]"
"26.206738","185.220.101.164","54.36.163.65","293","TLSv1.2","Application Data"
"26.583560","185.220.101.164","54.36.163.65","603","TLSv1.2","Application Data"
"26.606721","185.220.101.164","54.36.163.65","603","TLSv1.2","Application Data"
"26.983867","185.220.101.164","54.36.163.65","1480","TLSv1.2","Application Data"
"27.011072","185.220.101.164","54.36.163.65","2108","TCP","24824  >  8001 [PSH, ACK] Seq=340879 Ack=1 Win=21 Len=2048 [TCP segment of a reassembled PDU]"
"27.011072","185.220.101.164","54.36.163.65","1498","TCP","24824  >  8001 [PSH, ACK] Seq=342927 Ack=1 Win=21 Len=1438 [TCP segment of a reassembled PDU]"
"27.038817","185.220.101.164","54.36.163.65","670","TLSv1.2","Application Data [TCP segment of a reassembled PDU]"
"27.080763","185.220.101.164","54.36.163.65","456","TCP","[TCP Previous segment not captured] 24824  >  8001 [PSH, ACK] Seq=345999 Ack=1 Win=21 Len=396 [TCP segment of a reassembled PDU]"
"27.080763","185.220.101.164","54.36.163.65","1084","TCP","[TCP Out-Of-Order] 24824  >  8001 [ACK] Seq=344975 Ack=1 Win=21 Len=1024 [TCP segment of a reassembled PDU]"
"27.115032","185.220.101.164","54.36.163.65","128","TCP","[TCP Previous segment not captured] 24824  >  8001 [PSH, ACK] Seq=347419 Ack=1 Win=21 Len=68 [TCP segment of a reassembled PDU]"
"27.115033","185.220.101.164","54.36.163.65","1084","TCP","[TCP Out-Of-Order] 24824  >  8001 [ACK] Seq=346395 Ack=1 Win=21 Len=1024 [TCP segment of a reassembled PDU]"
"27.364391","185.220.101.164","54.36.163.65","1480","TLSv1.2","Application Data [TCP segment of a reassembled PDU]"
"27.423287","185.220.101.164","54.36.163.65","2108","TCP","24824  >  8001 [PSH, ACK] Seq=348907 Ack=1 Win=21 Len=2048 [TCP segment of a reassembled PDU]"
"27.423287","185.220.101.164","54.36.163.65","688","TCP","24824  >  8001 [PSH, ACK] Seq=350955 Ack=1 Win=21 Len=628 [TCP segment of a reassembled PDU]"
"27.481370","185.220.101.164","54.36.163.65","1480","TLSv1.2","Application Data [TCP segment of a reassembled PDU]"
"27.547368","185.220.101.164","54.36.163.65","1084","TCP","24824  >  8001 [ACK] Seq=353003 Ack=1 Win=21 Len=1024 [TCP segment of a reassembled PDU]"
"27.547368","185.220.101.164","54.36.163.65","524","TCP","[TCP Previous segment not captured] 24824  >  8001 [PSH, ACK] Seq=355051 Ack=1 Win=21 Len=464 [TCP segment of a reassembled PDU]"
"27.547368","185.220.101.164","54.36.163.65","1084","TCP","[TCP Out-Of-Order] 24824  >  8001 [PSH, ACK] Seq=354027 Ack=1 Win=21 Len=1024 [TCP segment of a reassembled PDU]"
"27.627554","185.220.101.164","54.36.163.65","1398","TLSv1.2","Application Data [TCP segment of a reassembled PDU]"
"27.661583","185.220.101.164","54.36.163.65","456","TLSv1.2","[TCP Previous segment not captured] , Ignored Unknown Record"
"27.735956","185.220.101.164","54.36.163.65","292","TLSv1.2","[TCP Previous segment not captured] , Ignored Unknown Record"
"27.763206","185.220.101.164","54.36.163.65","239","TLSv1.2","Ignored Unknown Record"
"28.171922","185.220.101.164","54.36.163.65","603","TLSv1.2","Application Data"
"28.207498","185.220.101.164","54.36.163.65","1631","TLSv1.2","Application Data"
"28.537019","185.220.101.164","54.36.163.65","93","TLSv1.2","[TCP Previous segment not captured] , Ignored Unknown Record"
"28.567491","185.220.101.164","54.36.163.65","456","TLSv1.2","[TCP Previous segment not captured] , Ignored Unknown Record"
"28.594272","185.220.101.164","54.36.163.65","456","TLSv1.2","[TCP Previous segment not captured] , Ignored Unknown Record"
"28.710928","185.220.101.164","54.36.163.65","2108","TLSv1.2","Ignored Unknown Record"
"28.710929","185.220.101.164","54.36.163.65","606","TLSv1.2","Ignored Unknown Record"
"28.804256","185.220.101.164","54.36.163.65","292","TLSv1.2","[TCP Previous segment not captured] , Ignored Unknown Record"
"28.830731","185.220.101.164","54.36.163.65","1398","TLSv1.2","Ignored Unknown Record"
"28.963429","185.220.101.164","54.36.163.65","2108","TLSv1.2","Ignored Unknown Record"
"28.963429","185.220.101.164","54.36.163.65","852","TLSv1.2","Ignored Unknown Record"
"29.066220","185.220.101.164","54.36.163.65","1234","TLSv1.2","Ignored Unknown Record"
"29.174764","185.220.101.164","54.36.163.65","984","TLSv1.2","Ignored Unknown Record"
"29.362946","185.220.101.164","54.36.163.65","374","TLSv1.2","[TCP Previous segment not captured] , Ignored Unknown Record"
"29.386735","185.220.101.164","54.36.163.65","2108","TLSv1.2","Ignored Unknown Record"
"29.386735","185.220.101.164","54.36.163.65","688","TLSv1.2","Ignored Unknown Record"
"29.421816","185.220.101.164","54.36.163.65","1480","TLSv1.2","Ignored Unknown Record"
"29.543772","185.220.101.164","54.36.163.65","1316","TLSv1.2","Ignored Unknown Record"
"29.681288","185.220.101.164","54.36.163.65","653","TLSv1.2","Ignored Unknown Record"
"29.855514","185.220.101.164","54.36.163.65","603","TLSv1.2","Application Data"
"30.047364","185.220.101.164","54.36.163.65","603","TLSv1.2","Application Data"
"30.261678","185.220.101.164","54.36.163.65","603","TLSv1.2","Application Data"
"30.519672","185.220.101.164","54.36.163.65","1398","TCP","24824  >  8001 [PSH, ACK] Seq=384757 Ack=1 Win=21 Len=1338 [TCP segment of a reassembled PDU]"
"30.563259","185.220.101.164","54.36.163.65","2108","TLSv1.2","Application Data [TCP segment of a reassembled PDU]"
"30.563260","185.220.101.164","54.36.163.65","1424","TCP","24824  >  8001 [PSH, ACK] Seq=388143 Ack=1 Win=21 Len=1364 [TCP segment of a reassembled PDU]"
"30.596223","185.220.101.164","54.36.163.65","908","TCP","24824  >  8001 [PSH, ACK] Seq=389507 Ack=1 Win=21 Len=848 [TCP segment of a reassembled PDU]"
"30.676787","185.220.101.164","54.36.163.65","2108","TLSv1.2","Application Data [TCP segment of a reassembled PDU]"
"30.676895","185.220.101.164","54.36.163.65","442","TCP","24824  >  8001 [PSH, ACK] Seq=392403 Ack=1 Win=21 Len=382 [TCP segment of a reassembled PDU]"
"30.767635","185.220.101.164","54.36.163.65","2108","TLSv1.2","Application Data [TCP segment of a reassembled PDU]"
"30.767636","185.220.101.164","54.36.163.65","852","TCP","24824  >  8001 [PSH, ACK] Seq=394833 Ack=1 Win=21 Len=792 [TCP segment of a reassembled PDU]"
"30.875357","185.220.101.164","54.36.163.65","616","TLSv1.2","Application Data"
"31.213972","185.220.101.164","54.36.163.65","220","TLSv1.2","[TCP Previous segment not captured] , Ignored Unknown Record"
"31.438516","185.220.101.164","54.36.163.65","2108","TCP","24824  >  8001 [PSH, ACK] Seq=401379 Ack=1 Win=21 Len=2048 [TCP segment of a reassembled PDU]"
"31.438516","185.220.101.164","54.36.163.65","852","TCP","24824  >  8001 [PSH, ACK] Seq=403427 Ack=1 Win=21 Len=792 [TCP segment of a reassembled PDU]"
"31.469461","185.220.101.164","54.36.163.65","210","TCP","[TCP Previous segment not captured] 24824  >  8001 [PSH, ACK] Seq=405243 Ack=1 Win=21 Len=150 [TCP segment of a reassembled PDU]"
"31.469461","185.220.101.164","54.36.163.65","1084","TCP","[TCP Out-Of-Order] 24824  >  8001 [ACK] Seq=404219 Ack=1 Win=21 Len=1024 [TCP segment of a reassembled PDU]"
"31.632911","185.220.101.164","54.36.163.65","730","TLSv1.2","Application Data, Application Data"
"31.853976","185.220.101.164","54.36.163.65","603","TLSv1.2","Application Data"
"32.089691","185.220.101.164","54.36.163.65","1084","TLSv1.2","[TCP Previous segment not captured] , Ignored Unknown Record"
"32.089691","185.220.101.164","54.36.163.65","1424","TLSv1.2","Ignored Unknown Record"
"32.117146","185.220.101.164","54.36.163.65","729","TLSv1.2","Ignored Unknown Record"
"32.213459","185.220.101.164","54.36.163.65","1084","TCP","24824  >  8001 [ACK] Seq=410687 Ack=1 Win=21 Len=1024 [TCP segment of a reassembled PDU]"
"32.213459","185.220.101.164","54.36.163.65","688","TCP","[TCP Previous segment not captured] 24824  >  8001 [PSH, ACK] Seq=412735 Ack=1 Win=21 Len=628 [TCP segment of a reassembled PDU]"
"32.213459","185.220.101.164","54.36.163.65","1084","TCP","[TCP Out-Of-Order] 24824  >  8001 [PSH, ACK] Seq=411711 Ack=1 Win=21 Len=1024 [TCP segment of a reassembled PDU]"
"32.473995","185.220.101.164","54.36.163.65","2108","TLSv1.2","Application Data [TCP segment of a reassembled PDU]"
"32.473995","185.220.101.164","54.36.163.65","1186","TCP","24824  >  8001 [PSH, ACK] Seq=415411 Ack=1 Win=21 Len=1126 [TCP segment of a reassembled PDU]"
"32.531128","185.220.101.164","54.36.163.65","900","TCP","24824  >  8001 [PSH, ACK] Seq=416537 Ack=1 Win=21 Len=840 [TCP segment of a reassembled PDU]"
"32.675509","185.220.101.164","54.36.163.65","1084","TLSv1.2","Application Data [TCP segment of a reassembled PDU]"
"32.773897","185.220.101.164","54.36.163.65","128","TLSv1.2","[TCP Previous segment not captured] , Ignored Unknown Record"
"32.822183","185.220.101.164","54.36.163.65","1398","TLSv1.2","Ignored Unknown Record"
"33.000326","185.220.101.164","54.36.163.65","224","TLSv1.2","[TCP Previous segment not captured] , Ignored Unknown Record"
"33.267538","185.220.101.164","54.36.163.65","1117","TLSv1.2","Application Data"
"33.452820","185.220.101.164","54.36.163.65","603","TLSv1.2","Application Data"
"33.699224","185.220.101.164","54.36.163.65","2108","TLSv1.2","Application Data, Application Data"
"33.699224","185.220.101.164","54.36.163.65","155","TLSv1.2","Application Data"
"33.740058","185.220.101.164","54.36.163.65","1480","TCP","24824  >  8001 [PSH, ACK] Seq=428998 Ack=1 Win=21 Len=1420 [TCP segment of a reassembled PDU]"
